{
  "id": "DD-0123456789ab",
  "version": 2,
  "state": "reviewed",
  "source": "G042",
  "contracts": [
    "architecture.system"
  ],
  "documents": [
    "docs/architecture/overview.md"
  ],
  "reason": "documentation impact analysis",
  "evidence": [
    "EV-001"
  ],
  "created_at": "2026-09-09T12:00:00Z",
  "updated_at": "2026-09-09T12:05:00Z"
}
